{
  "type": "object",
  "$schema": "http://json-schema.org/draft-03/schema",
  "id": "http://jsonschema.net",
  "required": true,
  "properties": {
    "sourceAccount_id": {
      "type": "string",
      "required": true
      },
    "targetAccount_id": {
      "type": "string",
      "required": true
      },
    "amount": {
      "type": "number",
      "required": true
    },
    "description": {
      "type": "string",
      "required": false
      }
    }
}
